{
  "cases": [
    {
      "caseId": "seed-acl100",
      "defaultSeverity": "error",
      "expectedDiagnosticSha256": "e7088b12e6fd1ed4f63ac8cc6dbb2f48c243c7973b6ad7d9f65b7a2d0c463323",
      "expectedDisposition": "visible",
      "expectedRuleId": "ACL100",
      "familyId": "syntax-structure",
      "scenarioId": "syntax-acl100",
      "syntheticEvidence": true
    },
    {
      "caseId": "seed-acl101",
      "defaultSeverity": "error",
      "expectedDiagnosticSha256": "5ca305ee8cacabce33ba647384997218d56f1ceff9c78f2c74befd2095de1c1f",
      "expectedDisposition": "visible",
      "expectedRuleId": "ACL101",
      "familyId": "syntax-structure",
      "scenarioId": "syntax-acl101",
      "syntheticEvidence": true
    },
    {
      "caseId": "seed-acl102",
      "defaultSeverity": "warning",
      "expectedDiagnosticSha256": "f2428780b8d0cf4692da69c5d35726d1cd9517f14cc9a8ec5f0135e5c83f03a5",
      "expectedDisposition": "visible",
      "expectedRuleId": "ACL102",
      "familyId": "syntax-structure",
      "scenarioId": "syntax-acl102",
      "syntheticEvidence": true
    },
    {
      "caseId": "seed-acl103",
      "defaultSeverity": "error",
      "expectedDiagnosticSha256": "9071dfa2e81667bbd24ff197767314ec1c2bcdf4ccce8a73f4a41da186f623e9",
      "expectedDisposition": "visible",
      "expectedRuleId": "ACL103",
      "familyId": "syntax-structure",
      "scenarioId": "syntax-acl103",
      "syntheticEvidence": true
    },
    {
      "caseId": "seed-acl104",
      "defaultSeverity": "warning",
      "expectedDiagnosticSha256": "95ba2597019970012bd180ef53af6335eac42d52e8851a506cb12d1ef75405b6",
      "expectedDisposition": "visible",
      "expectedRuleId": "ACL104",
      "familyId": "syntax-structure",
      "scenarioId": "syntax-acl104",
      "syntheticEvidence": true
    },
    {
      "caseId": "seed-acl105",
      "defaultSeverity": "warning",
      "expectedDiagnosticSha256": "53e31068910c741583ed8d23ea6b07c83d831f2346a1fe8a2b81ce151a18dba3",
      "expectedDisposition": "visible",
      "expectedRuleId": "ACL105",
      "familyId": "syntax-structure",
      "scenarioId": "syntax-acl105",
      "syntheticEvidence": true
    },
    {
      "caseId": "seed-acl106",
      "defaultSeverity": "warning",
      "expectedDiagnosticSha256": "b1bcd719b973779b7371c75983ed3d0feba3f392a5a894bd423c23c16db8cd93",
      "expectedDisposition": "visible",
      "expectedRuleId": "ACL106",
      "familyId": "syntax-structure",
      "scenarioId": "syntax-acl106",
      "syntheticEvidence": true
    },
    {
      "caseId": "seed-acl107",
      "defaultSeverity": "warning",
      "expectedDiagnosticSha256": "70f090dffa202dc549214f58966a4af0a904b395eeaf9489ad052697c513d36a",
      "expectedDisposition": "visible",
      "expectedRuleId": "ACL107",
      "familyId": "syntax-structure",
      "scenarioId": "syntax-acl107",
      "syntheticEvidence": true
    },
    {
      "caseId": "seed-acl108",
      "defaultSeverity": "warning",
      "expectedDiagnosticSha256": "1ef866bcd8a9c99474b4b9ea7acc73d0be314a469a95bcacdd5b0361280e05c4",
      "expectedDisposition": "visible",
      "expectedRuleId": "ACL108",
      "familyId": "syntax-structure",
      "scenarioId": "syntax-acl108",
      "syntheticEvidence": true
    },
    {
      "caseId": "seed-acl109",
      "defaultSeverity": "warning",
      "expectedDiagnosticSha256": "5ab155b686ab24bdd3c5c84fb725d6d1bcae5dbac47b03068191e838d4ff436c",
      "expectedDisposition": "visible",
      "expectedRuleId": "ACL109",
      "familyId": "syntax-structure",
      "scenarioId": "syntax-acl109",
      "syntheticEvidence": true
    },
    {
      "caseId": "seed-acl150",
      "defaultSeverity": "error",
      "expectedDiagnosticSha256": "197cf0c42b30d5bf5d2f27d9cb0f7f57f410e56128ac20701a0d460b78949719",
      "expectedDisposition": "visible",
      "expectedRuleId": "ACL150",
      "familyId": "references-imports",
      "scenarioId": "references-paths",
      "syntheticEvidence": true
    },
    {
      "caseId": "seed-acl151",
      "defaultSeverity": "error",
      "expectedDiagnosticSha256": "c4db9ddd46fe9d244131e8297320497fae18823797a226b7fb58dff062f95135",
      "expectedDisposition": "visible",
      "expectedRuleId": "ACL151",
      "familyId": "references-imports",
      "scenarioId": "references-paths",
      "syntheticEvidence": true
    },
    {
      "caseId": "seed-acl152",
      "defaultSeverity": "error",
      "expectedDiagnosticSha256": "f24f4a873a7deaec5bb50b794dc1d2ebdd28dd2814e5eeca508936fc62b24b67",
      "expectedDisposition": "visible",
      "expectedRuleId": "ACL152",
      "familyId": "references-imports",
      "scenarioId": "references-paths",
      "syntheticEvidence": true
    },
    {
      "caseId": "seed-acl153",
      "defaultSeverity": "warning",
      "expectedDiagnosticSha256": "b0bc1f024b77c5ef8cb6503ff4dc665bfaeb86ca9249830cc6c15ce7632a6376",
      "expectedDisposition": "visible",
      "expectedRuleId": "ACL153",
      "familyId": "references-imports",
      "scenarioId": "references-paths",
      "syntheticEvidence": true
    },
    {
      "caseId": "seed-acl154",
      "defaultSeverity": "warning",
      "expectedDiagnosticSha256": "39c16635a93639097833565877ba2d1441d808e95bdf6b1ca83465bcb9244cb5",
      "expectedDisposition": "visible",
      "expectedRuleId": "ACL154",
      "familyId": "references-imports",
      "scenarioId": "references-paths",
      "syntheticEvidence": true
    },
    {
      "caseId": "seed-acl155",
      "defaultSeverity": "warning",
      "expectedDiagnosticSha256": "e65f34c0eae9a490f42e207f9dc2467d48f9b3637424d9e4d8e524f1862b2a94",
      "expectedDisposition": "visible",
      "expectedRuleId": "ACL155",
      "familyId": "references-imports",
      "scenarioId": "references-unsupported",
      "syntheticEvidence": true
    },
    {
      "caseId": "seed-acl156",
      "defaultSeverity": "warning",
      "expectedDiagnosticSha256": "fa81dd81d579b483dd6b410331d272f1e6b265c65a0b9a294cc7fecb46ad4c8d",
      "expectedDisposition": "visible",
      "expectedRuleId": "ACL156",
      "familyId": "references-imports",
      "scenarioId": "references-paths",
      "syntheticEvidence": true
    },
    {
      "caseId": "seed-acl200",
      "defaultSeverity": "error",
      "expectedDiagnosticSha256": "5bcb4909bff6d694c7c4cd2f9da210a680e34bcc5f4ae898365f62ac5e68f2fa",
      "expectedDisposition": "visible",
      "expectedRuleId": "ACL200",
      "familyId": "scope-activation",
      "scenarioId": "scope-acl200",
      "syntheticEvidence": true
    },
    {
      "caseId": "seed-acl201",
      "defaultSeverity": "warning",
      "expectedDiagnosticSha256": "1afba521b2ab77dd4667427aa8e0c2eaa691de7330cd1a7913410d35106afee8",
      "expectedDisposition": "visible",
      "expectedRuleId": "ACL201",
      "familyId": "scope-activation",
      "scenarioId": "scope-acl201",
      "syntheticEvidence": true
    },
    {
      "caseId": "seed-acl202",
      "defaultSeverity": "warning",
      "expectedDiagnosticSha256": "180bd60e0a57e4bb6845eaab74dbae41443bf493985e1fe71228119cbfb9524a",
      "expectedDisposition": "visible",
      "expectedRuleId": "ACL202",
      "familyId": "scope-activation",
      "scenarioId": "scope-acl202",
      "syntheticEvidence": true
    },
    {
      "caseId": "seed-acl203",
      "defaultSeverity": "warning",
      "expectedDiagnosticSha256": "75a5ecceffab91182a64c375a48c60fd3bee68e522b44a47246b6579248267a8",
      "expectedDisposition": "visible",
      "expectedRuleId": "ACL203",
      "familyId": "scope-activation",
      "scenarioId": "scope-acl203",
      "syntheticEvidence": true
    },
    {
      "caseId": "seed-acl204",
      "defaultSeverity": "warning",
      "expectedDiagnosticSha256": "2064faa4abb7040ac5c7a076e10fcbb5cfd5a8985cb6e18431144603366cbfd9",
      "expectedDisposition": "visible",
      "expectedRuleId": "ACL204",
      "familyId": "scope-activation",
      "scenarioId": "scope-acl204",
      "syntheticEvidence": true
    },
    {
      "caseId": "seed-acl205",
      "defaultSeverity": "warning",
      "expectedDiagnosticSha256": "29aef35c1f48067346b4df401eb994610f8a4832e82af6ffbfdc30262cb85961",
      "expectedDisposition": "visible",
      "expectedRuleId": "ACL205",
      "familyId": "scope-activation",
      "scenarioId": "scope-acl205",
      "syntheticEvidence": true
    },
    {
      "caseId": "seed-acl206",
      "defaultSeverity": "info",
      "expectedDiagnosticSha256": "10b08b4fd95b5968023bb37e8ef07cdd287192d34752d3c5a3ff292ba8e983a2",
      "expectedDisposition": "visible",
      "expectedRuleId": "ACL206",
      "familyId": "scope-activation",
      "scenarioId": "scope-acl206",
      "syntheticEvidence": true
    },
    {
      "caseId": "seed-acl250",
      "defaultSeverity": "error",
      "expectedDiagnosticSha256": "262c47f49eb27c0e9b625dc8397114a5c8d1c562a81c523f548296440e7865cc",
      "expectedDisposition": "visible",
      "expectedRuleId": "ACL250",
      "familyId": "conflicts-duplication",
      "scenarioId": "conflicts-acl250",
      "syntheticEvidence": true
    },
    {
      "caseId": "seed-acl251",
      "defaultSeverity": "error",
      "expectedDiagnosticSha256": "2a6063cbea00e8dd3d3208d8ba2b1853da53e5b9031cfe7acb339fe0cfef5b0a",
      "expectedDisposition": "visible",
      "expectedRuleId": "ACL251",
      "familyId": "conflicts-duplication",
      "scenarioId": "conflicts-acl251",
      "syntheticEvidence": true
    },
    {
      "caseId": "seed-acl252",
      "defaultSeverity": "warning",
      "expectedDiagnosticSha256": "4f493be39e91a5b757a4a7942bae8f04f8113d082b4d206cf2398102916fedc7",
      "expectedDisposition": "visible",
      "expectedRuleId": "ACL252",
      "familyId": "conflicts-duplication",
      "scenarioId": "conflicts-acl252",
      "syntheticEvidence": true
    },
    {
      "caseId": "seed-acl253",
      "defaultSeverity": "warning",